id_materias,nome,creditos,descricao
ESHR022-14,Abordagens Tradicionais das Relações Internacionais,4,"Contextualização histórica da emergência das teorias de relações internacionais. Matrizes filosóficas. Realismo. Idealismo. Debate clássico realismo versus idealismo. Escola inglesa. Behaviorismo. Debate metodológico. Neoliberalismo. Neorrealismo. Teoria da interdependência complexa. Neoinstitucionalismo. Cooperação e conflito. Sociedade internacional, anarquia. Regimes internacionais."
ESZM035-17,Aditivação de Polímeros,4,"Tipos de aditivos e métodos para obtenção de formulação polimérica. Degradação e estabilização de polímeros. Plastificantes, lubrificantes, antiestáticos, retardantes de chama, colorantes, agentes nucleantes, clarificantes e espumantes. Cargas. Mecanismos de atuação dos aditivos."
ESZP041-14,Administração Pública e Reforma do Estado em Perspectiva Comparada,4,"Estado, política e administração pública; Crise e reforma do Estado: as diversas respostas; A Nova Gestão Pública; Formas de responsabilização e accountability da administração pública; A experiência internacional da reforma do Estado; As experiências brasileiras da reforma do Estado; A agenda atual."
ESTS016-17,Aerodinâmica I,4,"Força de Sustenção e arrasto; Teoria do perfil delgado; Condição de Kutta-Jukowiski; Método da superposição de singularidades (fontes, sorvedouros, dipolos e vórtices); Transformação conforme; Solução numérica: método dos painéis. Teoria dos perfis NACA. Esteira, descolamento de camada limite e efeitos da turbulência. Introdução à teoria de asas tridimensionais, via teoria da linha de sustentação."
ESZS019-17,Aerodinâmica II,4,Física do escoamento subsônico e hipersônico. Equações de governo do escoamento no contexto da teoria do potencial e sua linearização. Método da linha de sustentação. Método da superfície de sustentação. Técnicas de análise de escoamento hipersônico.
ESTS012-17,Aeroelasticidade,4,Comportamento aeroelástico de veículos aeroespaciais e outras estruturas. Elasticidade estática e seu impacto no desempenho de superfícies de sustentação. Conceitos fundamentais de aerodinâmica não estacionaria e técnicas computacionais modernas. Aeroelasticidade dinâmica (flutter) de uma seção típica e de uma asa de um veículo aeroespacial.
ESTS002-17,Aeronáutica I-A,4,"Conhecimentos técnicos sobre aviões: Anatomia do avião, sistemas e instrumentos de voo; princípios de operação do grupo moto propulsor; limitações e informações operacionais. Teoria de voo: Princípios de voo de aviões; introdução à aerodinâmica; noções de desempenho e limitações humanas. Dispositivos de comandos de voo; fases de voos; estabilidade do voo."
ESZS001-17,Aeronáutica I-B,4,"Conhecimentos técnicos sobre helicópteros: anatomia do helicóptero, sistemas e instrumentos de voo; princípios de operação do grupo moto propulsor; limitações e informações operacionais. Teoria de voo: Princípios de voo de aeronaves de asas rotativas; introdução à aerodinâmica de helicópteros."
ESZS002-17,Aeronáutica II,4,Regulamentação aeronáutica: regras do ar; regras de voo visual; serviços de tráfego aéreo; fraseologia. Meteorologia: introdução à meteorologia; meteorologia aeronáutica; informações meteorológicas. Navegação aérea: aspectos práticos da navegação aérea e técnicas de navegação estimada; utilização de cartas aeronáuticas. Planejamento de voo e procedimentos operacionais: utilização dos sites de Consulta de Informações Aeronáuticas (AIS WEB) e da Rede de Meteorologia do Comando da Aeronáutica (REDEMET).
MCTB001-17,Álgebra Linear,6,Sistemas de Equações Lineares: Sistemas e matrizes. Matrizes escalonadas. Sistemas homogêneos. Posto e Nulidade de uma matriz. Determinantes. Espaço Vetorial: Definição e exemplos. Subespaços vetoriais. Combinação linear. Dependência e independência linear. Base de um espaço vetorial e mudança de base. Produto interno. Transformações Lineares: Definição de transformação linear e exemplos. Núcleo e imagem de uma transformação linear. Transformações lineares e matrizes. Matriz mudança de base. Autovalores e Autovetores: Polinômio característico. Base de autovetores. Diagonalização de operadores.
MCTB002-13,Álgebra Linear Avançada I,4,Corpos. Espaço Vetorial sobre um corpo. Base e dimensão. Espaços Quocientes. Funcionais Lineares. Espaços Duais. Complexificação. Transformações Lineares. Espaços Invariantes. Polinômios (Anéis de Polinômios). Forma de Jordan Complexa e Real. Forma Canônica Racional.
MCTB003-17,Álgebra Linear Avançada II,4,"Formas Bilineares e Sesquilineares: Formas Ortogonais, Hermitianas e Simpléticas; Teorema de Classificação das Formas Ortogonais, Hermitianas e Simpléticas. Espaços com produto interno e Hermitiano. Grupos Clássicos. Álgebra Multilinear: Aplicações Multilineares, Produto Tensorial, Isomorfismos Canônicos, Tensores Simétricos e Antissimétricos. Álgebra Exterior."
MCTD022-18,Álgebra na Educação Básica,2,"Introdução à teoria de grupos. Grupos de permutação e suas relações com a Geometria. Aplicações de grupos na Educação Básica. Aplicações de Anéis na Educação Básica. Aplicações de Anéis de Polinômios na Educação Básica. Discutir em cada momento, a importância de aprender esses conteúdos para a formação do professor de matemática. Relacionar esses conteúdos com os conteúdos da escola básica. Em especial, discutir, o conjunto dos números racionais, o conjunto dos reais, dos Complexos, Polinômios (Equações e funções). Fazer conexões entre a álgebra, aritmética e geometria."
MCTA001-17,Algoritmos e Estruturas de Dados I,4,Breve introdução à linguagem C. Noções básicas de análise de complexidade de tempo de algoritmos. Estruturas lineares: busca e ordenação. Árvores de busca. Árvores balanceadas.
MCTA002-17,Algoritmos e Estruturas de Dados II,4,Hashing. Introdução a arquivos. Arquivos sequenciais. Arquivos indexados. Arquivos de acesso direto. Prática de programação dos arquivos e das funções primitivas na resolução de problemas. Compressão de arquivos.
MCZA035-17,Algoritmos Probabilísticos,4,Revisão de probabilidade discreta. Exemplos de algoritmos aleatorizados: Algoritmo para Identidade polinomial; Sigilo perfeito; MAX 3-SAT. Leis de desvios e aplicações em algoritmos e estruturas de dados: hashing universal; treaps. Modelos de computação e classes probabilísticas de complexidade. Aplicações de Cadeias de Markov. Passeios aleatórios em grafos. Algoritmos distribuídos probabilísticos.
MCZB001-13,Análise Complexa,4,"Integração no Plano Complexo: homotopia e integração. Funções harmônicas no plano. Os espaços de funções holomorfas e meromorfas. Produtos infinitos e o teorema de Weierstrass. As funções Gama e Zeta, aproximação de funções analíticas por funções racionais. A esfera de Riemann. Equivalências conformes. Automorfismos dos números complexos e do disco unitário. Teorema da Uniformização de Riemann, aplicações conformes."
ESHR001-13,Análise da Conjuntura Internacional Contemporânea,4,"Proporcionar uma visão analítica da formulação e da tomada de decisão em política externa de forma a conhecer e interpretar as relações internacionais contemporâneas e seus desdobramentos. Analisar cenários de relações internacionais de uma perspectiva integrada. Identificação dos processos decisórios em relações internacionais a partir de estudos de caso da conjuntura internacional. Identificação dos atores nacionais e internacionais. Interpretação a partir das principais escolas e teorias de análise. Agências governamentais, papel dos atores não governamentais, mecanismos dos lobbies e dos poderes legislativos. Avaliação analítica da escala de objetivos – permanentes, padrões e preferências políticas. Desafios da inserção internacional do Brasil."
ESZT001-17,Análise da Produção do Espaço e Políticas Públicas Urbanas,4,"Processo de produção do espaço como produto e condição da reprodução social. Instrumentos diagnósticos e referenciais para elaboração e implantação de políticas públicas. O espaço como produto e condição da reprodução social. O espaço urbano contemporâneo: segregação, fragmentação e hierarquização. As especificidades do espaço urbano em países periféricos: a segregação como parte do processo de produção do urbano. Políticas públicas urbanas: seus impasses e limites na superação de um espaço urbano periférico."
MCTA003-17,Análise de Algoritmos,4,"Conceitos básicos: recorrências, medidas de complexidade: melhor caso, caso médio e pior caso. Técnicas gerais de projeto de algoritmos: divisão e conquista, método guloso e programação dinâmica. Classes de complexidade: P, NP e NP-completude."
MCZA036-17,Análise de Algoritmos II,4,"A estratégia gulosa. Matroides e fundamentos teóricos da estratégia gulosa. Árvore geradora mínima, código de Huffman, Fórmulas de Horn. Métodos geométricos elementares e interseção geométrica. Problemas do Fecho convexo e dos pares de pontos mais próximos. Problemas de Otimização e Algoritmos aproximativos. Algoritmos aproximativos para Mochila, Cobertura, Caixeiro Viajante. Paradigma quântico, qubits, superposição e medida. Algoritmo de fatoração de Shor e Algoritmo de busca de Grover."
NHT3067-15,Análise de Fourier e Aplicações,4,"Séries de Fourier, integração, diferenciação. Representação de funções por séries de Fourier e o fenômeno de Gibbs. Aplicações de séries de Fourier em problemas de contorno: equações do calor, de Laplace, de cordas e de membranas. Transformadas de Fourier, inversão, derivação e teorema de convolução. Função Delta de Dirac. Aplicações em problemas de contorno e na mecânica quântica. Transformadas de Laplace, inversão e aplicações."
MCZA001-13,Análise de Projetos,2,Introdução à Análise de Sistemas. Metodologia de Desenvolvimento Orientada a Objetos. Aspectos de Arquitetura de Software.
ESZG001-17,Análise de Redes de Transporte e Distribuição,4,"Conceituação; grafos, redes e modelos de rede; modelos de problemas de transporte e atribuição; máximo fluxo em redes; mínimo custo do fluxo em rede; otimização do transporte em redes; aplicação com uso de recurso computacional; técnicas heurísticas de busca."
MCZB002-13,Análise de Regressão,4,Regressão linear simples. Regressão linear múltipla. Métodos de diagnóstico. Métodos de seleção de variáveis. Modelos lineares generalizados.
ESZC001-17,Análise de Séries Temporais - Tópicos Especiais,4,"Modelos  multivariados estacionários: modelos vetoriais auto-regressivos (VAR), função impulso-resposta e causalidade de Granger. Cointegração: modelo vetorial de correção de erros (VECM) e teste de cointegração de Johansen. Introdução às séries temporais no domínio da frequência. A análise espectral clássica: conceitos e definições da análise de Fourier. Função de densidade espectral. Representações espectrais. Estimadores espectrais e estimadores espectrais suavizados. Testes para periodicidades. Introdução à análise de processos estocásticos integrados fracionariamente: conceitos e definições. Modelo auto-regressivo fracionariamente integrado e de médias móveis (ARFIMA). Estimadores do parâmetro de integração fracionária nos domínios do tempo e da frequência. Análise de cointegração fracionária em séries temporais: conceitos, definições e testes."
ESTA005-17,Análise de Sistemas Dinâmicos Lineares,3,Apresentação de sistemas dinâmicos lineares multivariáveis; descrição por equações de estado; extração dos autovalores e autovetores; matriz de transição de estados; estudo de estabilidade local e global; critérios de estabilidade de Lyapunov; linearização de sistemas dinâmicos não-lineares observabilidade; controlabilidade.
ESTU024-17,Análise de Sistemas e Modelagem Ambiental,3,"Introdução à Teoria Geral de Sistemas. Tipos de modelos. Métodos de validação e avaliação de modelos. Modelagem de sistemas ambientais: Conceituação, desenvolvimento e aplicação. Programação Linear. Interfaces de utilização e aplicações práticas de modelos ambientais. Modelos de simulação, previsão ou projeção, aplicados a casos de cunho ambiental. Estudos de problemas ambientais a partir da modelagem de sistemas."
ESZU027-17,Análise e Concepção Estrutural para a Engenharia,4,Análise de concepção estrutural para engenharia; Sistemas estruturais habitacionais; sistemas de fundações; avaliação da segurança das habitações em áreas de risco; interação solo-estrutura; técnicas de vistoria de edificações em áreas de risco; critérios para interdição e liberação de edificações afetadas por riscos estruturais; estratégias de intervenção e de monitoramento; estratégias preventivas; diagnóstico de estruturas afetadas por problemas ambientais em áreas de risco; estratégias e soluções para construção de edificações em áreas de interesse ambiental. Estudo de caso.
ESTB029-17,Análise e Controle de Sistemas Mecânicos,4,"Introdução a sistemas de controle em malha fechada em tempo contínuo e discreto. Resposta degrau e Impulso (por Laplace). Espaço de estados. Matriz de transição (propriedades, matriz de convolação, função de transferência). Controbabilidade e observabilidade (definição e matrizes). Projeto de controladores por método de alocação de polos e controle linear quadrático. Projeto por função de transferência (On/OFF e PID). Observadores de estado. Introdução ao controle discreto."
ESZC018-17,Análise Econômica de Projetos,4,"A diferença entre a análise econômica e financeira de projetos e programas. Análise de viabilidade econômico-financeira para empresas privadas, agências governamentais, bancos privados e bancos de fomento. Técnicas básicas para a análise de projetos e programas. A influência da estrutura de financiamento sobre a viabilidade do projeto. Falhas de mercado e viabilidade de projetos, programas e políticas. Análise de eficiência e equidade nos estudos de viabilidade."
ESTE037-17,Análise Econômica de Projetos Energéticos,4,Métodos de análise de viabilidade de investimentos aplicados a projetos energéticos. Alternativas de investimento e tomada de decisão. Decisões sob incertezas. Elaboração de cenários. Riscos no mercado de energia. Análise econômica e de mercado.
ESZE075-17,Análise Estática em Sistemas Elétricos de Potência,4,Esta disciplina aborda a modelagem dos componentes que envolvem sistemas elétricos de potência em regime permanente. Fluxo de potência para redes elétricas: fluxo de potência DC; fluxo de potência AC; fluxo de potência para sistemas de distribuição. Métodos de solução. Ajustes e controles. Elos em corrente contínua.
ESZS016-17,Análise Experimental de Estruturas,4,"Objetivos da análise experimental. Introdução à análise dimensional e de incertezas. Dispositivos para medições de forças, deslocamentos e deformações. Extensometros, transdutores de força e de pressão, sistemas de aquisição de dados. Procedimentos de ensaios. Interpretação de resultados. Noções de medição de deformações com fibra ótica. Acelerometria e tratamento de sinais. Estudos de casos - Exemplos de aplicação em laboratórios."
MCZB003-17,Análise Multivariada,4,Gráficos multivariados. Regressão multivariada. Componente principal. Análise fatorial. Discriminação e classificação. Análise de agrupamentos. Escalonamento multidimensional. Correlação canônica. Análise de correspondência. Análise de variância multivariada.
MCTD024-18,Análise na Educação Básica,2,"Funções reais de variável real. Continuidade, derivação e integração de funções reais de variável real. Aspectos cognitivos e didático-pedagógicos da formação do conceito de função. Sistematização do conhecimento matemático orientada para a prática pedagógica na educação escolar básica."
MCTB004-17,Análise no Rn I,4,"Topologia do espaço Euclidiano n-dimensional. Continuidade de funções reais de n variáveis reais. Diferenciabilidade de funções reais de n variáveis reais: o Teorema de Schwarz, a fórmula de Taylor, máximos e mínimos e funções convexas. Funções Implícitas: função implícita, hiper-superfícies e multiplicadores de Lagrange. Aplicações diferenciáveis: a derivada como transformação linear, várias funções implícitas e o Teorema da Aplicação Inversa."
MCZB004-18,Análise no Rn II,4,"Integrais múltiplas: definição de integral, conjuntos de medida nula, condição de integrabilidade (Teorema de Lebesgue), conjuntos J-mensuráveis. Integral como limite de somas de Riemann. Mudança de variáveis. Formas diferenciais. Integrais de superfícies. Teorema de Stokes."
MCZB005-17,Análise Numérica,4,"Resolução de sistemas lineares. Métodos diretos: Eliminação de Gauss, Decomposição LU, Decomposição de Cholewski. Análise de perturbação (condicionamento). Métodos iterativos: Métodos de Jacobi e Gauss-Seidel. Método dos gradientes conjugados. Aproximação por mínimos quadrados (linear nos parâmetros). Decomposição QR. Interpolação numérica: polinomial (fenômeno de Runge) e por partes (splines). Integração de Romberg. Quadratura Gaussiana. Análise de erro. Equações diferenciais ordinárias: problema do valor inicial, Métodos baseados em expansão de Taylor, Método de Runge-Kutta. Análise de convergência, estabilidade e consistência."
NHT4001-15,Análise Química Instrumental,6,"Técnicas espectroscópicas: emissão, absorção e fluorescência atômica, absorção e fluorescência molecular. Análise por injeção em fluxo. Espectrometria de massas: principais espectrômetros de massas e as respectivas técnicas de ionização. Técnicas hifenadas."
MCTB005-13,Análise Real I,4,"Números reais: propriedades e completeza. Topologia da Reta: conjuntos abertos e fechados, pontos de acumulação, conjuntos compactos e conjunto de cantor. Limite de funções reais. Funções contínuas: funções contínuas em conjuntos compactos e continuidade uniforme. Funções deriváveis: definição de derivada, derivada e crescimento local, funções deriváveis num intervalo, fórmula de Taylor, aplicações da derivada, concavidade e convexidade."
MCTB006-13,Análise Real II,4,"Integral de Riemann: definição, propriedades da integral, condições suficientes de integrabilidade. Integral de Riemann-Stieltjes. Teoremas clássicos do Cálculo Integral (Teorema Fundamental do Cálculo) e integrais impróprias. Sequências e séries de funções: convergência simples e convergência uniforme, propriedades da convergência uniforme, séries de potências e séries de Taylor."
ESZP045-13,Análise Social da Família e Implementação de Políticas Públicas,4,"Conceito de família; dinâmica familiar; as várias constituições familiares; laços de parentesco e relações sociais; famílias de camadas populares, camadas médias e classes abastadas; a idéia de casamento; direitos e deveres do casal; ascendência, regras de descendência e filiação; reprodução biológica e social; relações e papéis de gênero; divisão sexual do trabalho; hierarquia de gênero; programas sociais para famílias; políticas públicas de atenção à família: programa de saúde da família; programas de complementação de renda; programas de saúde da mulher; programas de combate à violência doméstica; programas de geração de emprego e renda; programas de educação; formulação de indicadores de acompanhamentos de políticas públicas para a família."
MCTB007-17,Anéis e Corpos,4,"Definição de anel e exemplos. Domínios de integridade e corpos. Subanéis. Homomorfismos e Isomorfismos. Ideais e anéis quociente. Anel dos polinômios, Algoritmo da Divisão e Critérios de irredutibilidade. Anéis euclidianos. Anéis principais. Anéis fatoriais."
NHZ2001-11,Antropologia Filosófica,4,"Introdução aos estudos da antropologia filosófica, leitura e debate de textosfilosóficos, sobretudo de fontes primárias, que apresentem de forma explícita ouvelada determinada concepção de ser humano. Em função da característica dinâmicado tema, a bibliografia poderá ser completada pelo professor responsável."
ESZS012-17,Aplicações de Elementos Finitos para Engenharia,4,"Princípio dos trabalhos virtuais. Derivação das equações fundamentais do método dos elementos finitos. Elementos unidimensionais. Elementos bi e tridimensionais. Condições de contorno e de carregamento. Formulação isoparamétrica. Análise de convergência. Aplicações: análise estrutural, análise harmônica e problemas de transferência de calor. Modelagem e solução em computador de problemas."
ESZI025-17,Aplicações de Microcontroladores,4,Principais famílias de microcontroladores. Utilização de linguagem de alto nível (linguagem C) e linguagem de baixo nível (assembly) na computação em tempo real. Aplicações de instrumentação microprocessada.
ESZI037-17,"Aplicações em Voz, Áudio e Acústica",4,Princípios de Acústica Digital; Normas de Medições Acústicas; Acústica de Ambientes; Modelagem das funções auditivas; Análise e Síntese de Sinais Musicais; Eletroacústica; Engenharia de Áudio.
MCZA002-17,Aprendizado de Máquina,4,Introdução. Tipos de aprendizado. Paradigmas de aprendizado. Avaliação experimental de algoritmos de Aprendizado de Máquina. Alguns algoritmos de Aprendizado de Máquina.
ESZE102-17,Aproveitamento Energético de Resíduos,4,"Resíduos agrícolas, industriais, florestais e urbanos - definições. Legislação associada. Gerenciamento e destinação final. Caracterização e preparo da matéria prima. Avaliação do potencial energético. Métodos de aproveitamento energético: processos bioquímicos e processos termoquímicos. Externalidades do uso energético."
NHZ2091-16,Argumentação e Ensino,4,"Nos dispositivos legais que orientam a Educação Básica brasileira, atribui-se à argumentação um papel central no ensino e, especificamente, no ensino filosófico. Propõe-se nessa disciplina apresentar conceitos-chave de lógica informal, expor criticamente modelos argumentativos usualmente trabalhados na Educação Básica e discutir algumas estratégias didáticas que utilizam a argumentação como cerne (como campeonatos de debates e jogos lógicos)."
ESZE097-17,Armazenamento de Energia Elétrica,4,Introdução aos sistemas EES (Electrical Energy Storage). Tipos de sistemas. Aplicações dos sistemas EES. Maturidade técnica dos sistemas EES. Armazenamento de energia térmica. Tipos de acumuladores de energia térmica. Materiais de troca de fase. Piscinas solares (solar ponds). Armazenamento de energia em ar comprimido (CAES). Tipos e funcionamento dos sistemas CAES. Usinas hidrelétricas reversíveis (Pumped Hydro Storage – PHS). Funcionamento de uma usina PHS. Tipos de usinas PHS. Volantes de inercia (flywheels). Funcionamento de um flywheel. Tipos de flywheel. Pilhas e baterias eletroquímicas. Parâmetros de uma bateria eletroquímica. Baterias de fluxo. Células a combustível. Tipos de células a combustível. Sistemas SMES (Superconducting Magnetic Energy Storage). Materiais supercondutores. Configuração básica de um SMES. Capacitores. Capacitores eletrostáticos. Capacitores eletrolíticos. Capacitores eletroquímicos (ECs).
MCTA004-17,Arquitetura de Computadores,4,"História e Evolução dos Computadores e Sistemas; Estrutura de Computadores Digitais; Lógica Digital Binária; Processamento; Instruções e linguagem de máquina; Microprocessadores modernos: pipeline, super-escalar, RISC; Memórias cache e gerenciamento de memórias; Arquitetura de computadores pessoais; Arquitetura de Computadores Paralelos; Sistemas Computacionais: desempenho e confiabilidade."
MCZA003-17,Arquitetura de Computadores de Alto Desempenho,4,Introdução à computação de alto desempenho. Características sistêmicas da computação de alto desempenho. Organização de hardware em computação paralela. Organização e topologias de Interconexões. Organização da memória. Organização dos sistemas operacionais. Aspectos de programação paralela. Avaliação de desempenho.
ESHT001-17,Arranjos Institucionais e Marco Regulatório do Território,2,"Conceitos de território e ordenamento territorial a luz do marco institucional brasileiro. A relação Estado-território numa perspectiva histórica: aspectos da construção do Estado e Nação Brasileira; conflitos sociais e territoriais presentes nesse processo de construção, relações estado, economia e regulação do território. As relações entre o projeto nacional e o planejamento territorial, o marco regulatório atual tendo em vista os novos recortes territoriais constituídos pelas problemáticas social, ambiental e econômica e as perspectivas de processos de reestruturação / reordenação territorial."
NHZ2092-16,Arte e Ensino,4,"Trata-se de construir uma reflexão sobre as contribuições que as diferentes linguagens artísticas podem oferecer ao ensino de modo geral. Para tanto, serão feitas leituras de obras de arte visando ao processo de ensino-aprendizagem. Também se buscará um aprofundamento das noções de imaginação, criatividade e sensibilidade, relacionando-as ao conhecimento em áreas distintas. Inclui-se ainda como horizonte da disciplina o conhecimento de experiências didáticas que articulem arte e educação, bem como a criação de material didático."
