id_materias,nome,creditos,descricao
NHI5015-15,LIBRAS,4,"Noções básicas de Libras – Introdução ao idioma visando comunicação inicial entre ouvintes e surdos. Conceitos de Deficiência Auditiva e Surdez: a concepção médica e concepção social. Método Combinado, Oralismo, Comunicação Total e Bilinguismo como propostas educacionais e suas implicações. Semelhanças e Diferenças entre línguas orais e gestuais do ponto de vista da compreensão, expressão e aquisição. Mitos sobre as línguas de sinais. Conceito de Libras. Legislação específica: a Lei nº 10.436, de 24/04/2002 e o Decreto nº 5.626, de 22/12/2005. Aspectos Lingüísticos da Libras: Fonologia, Morfologia, Sintaxe, Semântica, Pragmática. Políticas Educacionais Inclusivas para o surdo e o papel do intérprete na sua educação. Aquisição do Português como segunda língua e a escrita do surdo. Surdez: aspectos culturais."
NHT4023-15,Ligações Químicas,4,"Modelo de repulsão do par de elétrons do nível de valência - VSEPR, Teoria de ligação de Valência, Orbitais híbridos. Teoria dos orbitais moleculares. Ácidos e Bases. Simetria molecular. Teoria de bandas."
MCTA015-13,Linguagens Formais e Automata,4,"Conceitos básicos. Linguagens regulares: autômatos determinísticos e não-determinísticos, expressões regulares. Linguagens livres de contexto: gramática, autômatos a pilha. Linguagens recursivamente enumeráveis: máquinas de Turing determinísticas e não-determinísticas. Indecidibilidade: o problema da parada. Complexidade: definição das classes P e NP."
NHZ1095-19,Livro didático no ensino de conhecimentos biológicos,4,"Livro didático e seu papel no ensino de Biologia: limitações e possibilidades. Políticas Públicas relacionadas aos livros didáticos de Biologia e Ciências e o PNLD. Livros didáticos e práticas docentes. Conteúdos biológicos, imagens e atividades propostas nos Livros didáticos: origem, problemas e soluções. Métodos utilizados para análise de materiais didáticos. Produção de materiais didáticos. "
NHT4073-15,Livros Didáticos no Ensino de Química,4,"Análise dos documentos curriculares oficiais, com vistas a discutir seus referenciais pedagógicos. Reflexão sobre o papel do livro didático no ensino de química e análise da dinâmica de sua utilização em sala de aula. Análise e seleção de textos, atividades e outros materiais utilizados no ensino de química. Produção de material didático: elaboração por parte do aluno de uma proposta que considere as reflexões vivenciadas."
NHI2049-13,Lógica Básica,4,"Cálculo sentencial (ou proposicional) clássico: noções de linguagem, conectivos, dedução e teorema, semântica de valorações. Cálculo clássico de predicados de primeira ordem: os conceitos de linguagem de primeira ordem, igualdade, teorema da dedução, consequência sintática. Semântica: noções de interpretação, verdade em uma estrutura, modelo. O conceito formal de teoria, fecho dedutivo. Exposição informal de temas, e.g., acerca da consistência de teorias, completude de teorias."
NHZ2050-11,Lógica e os Fundamentos da Matemática,4,"A teoria de Georg Cantor do final do século XIX e os infinitos; a versão formalizada da teoria ingênua dos conjuntos de G. Frege e o paradoxo introduzido por Bertrand Russell; a expressabilidade dos objetos matemáticos (números, relações,funções, etc) em termos de conjuntos. A teoria ingênua dos conjuntos como uma apresentação informal da teoria axiomática dos conjuntos de Zermelo-Fraenkel."
ESZG039-17,Lógica em Sistemas de Gestão,4,"Lógicas clássicas e lógicas heterodoxas: princípios gerais; classificação das lógicas e suas aplicações em Engenharia de Gestão; lógica boolena; teoria de conjuntos clássica e fuzzy: propriedades e relações. lógica fuzzy: mecanismos de inferência e métodos de classificação booleanos e fuzzy e suas principais aplicações em Engenharia de Gestão e produção; métodos de fuzzificação, implicação, agregação de conjuntos e de fuzzificação; caracterização de modelos aplicáveis a Engenharia de Gestão e de produção e cálculo de outputs; comparação de desempenho de modelos booleanos e fuzzy com relação ao índice de acerto e ao tempo de execução de sistemas para Engenharia de Gestão e produção."
ESZA017-17,Lógica Programável,4,Dispositivos lógicos programáveis; linguagem VHDL; estilos de descrição em VHDL; elementos sintáticos do VHDL; redes combinacionais em VHDL; redes seqüenciais em VHDL; síntese de circuitos digitais utilizando uma ferramenta CAE; projetos em VHDL.
MCZA013-13,Lógicas Não Clássicas,4,Caracterização da Lógica Clássica e das Lógicas não-clássicas. Lógicas não-monotônicas. Lógica Fuzzy. Lógicas Modais.
ESZU013-17,Logística e Meio Ambiente,2,"Sustentabilidade; Economia espacial e meio ambiente, Cadeia de suprimentos; Fluxos logísticos; O conceito de custo total; Opções modais e integração modal; Otimização de redes logísticas (locação de instalações e racionalização de redes de distribuição); Ciclo de vida; Logística reversa; Logística internacional e barreiras não alfandegárias; Lei nº 12.305/10 (política nacional de resíduos sólidos); Impactos ambientais de operações logísticas; Avaliação econômica e ambiental de projetos logísticos; Licenciamento; Operações logísticas com cargas perigosas."
ESHC022-17,Macroeconomia I,4,Principais agregados macroeconômicos. Identidades básicas de contas nacionais. O mercado monetário e o mercado de bens. O modelo IS/LM para uma economia fechada: equilíbrio no mercado de bens e no mercado de moeda no curto prazo. A equivalência entre o equilíbrio no mercado de bens e a igualdade entre poupança e investimento. Equilíbrio no mercado de trabalho e taxa natural de desemprego. O mecanismo de ajustamento de preços e a convergência da taxa de desemprego para a taxa natural de desemprego no médio prazo. O modelo de oferta agregada e demanda agregada (AS/AD): produção e preços no médio prazo. Modelos IS/LM e AS/AD: efeitos de políticas fiscais e monetárias sobre a produção e preços no curto e no médio prazo. Curva de Phillips: versão original e aceleracionista.
ESHC032-17,Macroeconomia II,4,Preços e rendimentos dos títulos. Teorias de consumo: teoria da renda permanente e teoria do ciclo de vida. Teorias de Investimento: teoria clássica do investimento e q de Tobin. O modelo IS-LM expandido com expectativas. O modelo de Mundell-Fleming: a adaptação do modelo IS-LM para o caso de uma economia aberta. Expectativas racionais e ciclos de negócios.
ESHC024-17,Macroeconomia III,4,"Os fatos estilizados de crescimento econômico. Modelo Harrod-Domar. O modelo de Solow na versão simples. O Modelo de Solow com progresso técnico. Regra de Ouro. Modelos AK de crescimento endógeno: modelos com capital humano e modelos de crescimento econômico através de learningbydoing. O modelo de crescimento endógeno de Romer, de uma economia com dois setores. O modelo de Lucas de Capital Humano."
ESHC031-17,Macroeconomia Pós-Keynesiana,4,"Princípios metodológicos: contestação da maximização e do equilíbrio. Economia e sua complexidade: interação entre a micro e a macroeconomia. O Princípio da Demanda Efetiva e a crítica à Lei de Say. Keynes: a determinação do emprego e da renda. Incerteza e expectativas em Keynes. Preferência pela Liquidez, demanda de moeda e lei de precificação dos ativos. Teoria dos preços e da distribuição em Kalecki. Determinantes do investimento e ciclos econômicos. Minsky e a instabilidade financeira. Modelos de crescimento com restrição externa. Lei de Thirlwall."
ESZS025-17,Máquinas de Fluxo,4,"Definições básicas máquinas operatrizes e motoras. Bombas centrífugas, de fluxo axial e misto. Turbinas de ação e reação. Compressores. Turbinas com escoamento compressível. Análise de desempenho e projeto de hélices aeronáuticas e marítimas e de turbinas hidráulicas e Eólicas."
ESTA016-17,Máquinas Elétricas,4,"Introdução às máquinas rotativas. Máquinas de corrente contínua: aspectos do circuito elétrico e magnético, circuito equivalente. Máquinas Síncronas: aspectos do circuito elétrico e magnético, circuito equivalente, obtenção dos parâmetros pelas características de operação em vazio e em curto-circuito, características de operação em regime permanente, efeitos dos polos salientes. Motores de Indução: aspectos do circuito elétrico e magnético, circuito equivalente, características de operação em regime permanente. Obtenção dos parâmetros e , efeito de sua mudança nas características de operação."
ESZE085-17,Máquinas Térmicas de Fluxo,4,"Fundamentos de termodinâmica e aerodinâmica; Estudo de turbinas térmicas e compressores: classificação, componentes, equipamentos auxiliares, operação, análise de eficiência, critérios de seleção e curvas características. Especificação básica e projeto preliminar."
MCTB019-17,Matemática Discreta,4,"Teoria intuitiva dos conjuntos. Operações com conjuntos. Álgebra de conjuntos. Relações: relações de equivalência, relações de ordem. Funções. Coleções de Conjuntos. Conjuntos Numéricos. Cardinalidade. Técnicas de demonstração: prova direta, prova por contradição. Indução Finita. Introdução à Análise Combinatória. Princípio multiplicativo. Princípio aditivo. Permutação, arranjo, combinação. Princípio de inclusão e exclusão. O princípio da casa dos pombos. Funções geradoras. Partição de um inteiro. Relações de recorrência."
MCZD004-18,Matemática nos Anos Iniciais,4,Aspectos interdisciplinares no Ensino Matemática nas series iniciais (possiblidades e desafios); LDB; O Ensino de Matemática nos Parâmetros Curriculares Nacionais para o Ensino Fundamental – Anos iniciais; Alfabetização Matemática; Alfabetização e Letramento.
ESTM017-17,Materiais Cerâmicos,4,"Histórico da obtenção e utilização de materiais cerâmicos. Matérias primas cerâmicas. A ligação iônica e covalente e sua importância em materiais cerâmicos. Microestrutura de materiais cerâmicos. Principais tipos de estruturas e defeitos cristalinos encontradas em cerâmicas. Estrutura de silicatos. Interpretação de diagramas de fases binários e ternários. Estrutura e crescimento de grãos em materiais cerâmicos. Reações no estado solido. Processos de conformação de materiais cerâmicos. Secagem, sinterização e acabamento. Tecnologia de vidros. Propriedades típicas de materiais cerâmicos. Aplicações de materiais cerâmicos"
ESTM008-17,Materiais Compósitos,4,"Tipos e classificação (materiais para matriz e fase dispersa), Compósitos de matriz metálica, matriz polimérica e matriz cerâmica. Fases dispersas: fibras e partículas. Interfaces: matriz/fase dispersa Micromecânica. Defeitos e falhas. Aperfeiçoamento das propriedades, propriedades sob medida. Comparação com componentes originais. Processamento de compósitos. Aplicações de compósitos."
ESTS009-17,Materiais Compósitos e Aplicações Estruturais,4,"Conceitos básicos: materiais, processos; Comportamento elástico da lâmina compósita – macro mecânica; Resistência da lâmina unidirecional – macro mecânica; Comportamento elástico de lâminas multidirecionais; Tensão e falha de lâminas multidirecionais; Métodos experimentais para caracterização e teste de matérias compósitos."
ESTO006-17,Materiais e Suas Propriedades,4,"Revisão de estrutura atômica e ligações químicas. Classificação dos materiais: metais, polímeros, cerâmicas e materiais avançados (compósitos, semicondutores, etc.). Microestrutura dos materiais: estrutura cristalina e defeitos em metais, cerâmicas e polímeros. Propriedades dos materiais: mecânicas, térmicas, elétricas, ópticas e magnéticas. Caracterização de materiais: técnicas de análise microestrutural e ensaios mecânicos."
ESZE108-17,Materiais e Tecnologias de Conversão Fotovoltaica,2,"A Física da célula solar. Limites teóricos de eficiência de células solares. Células e módulos de silício monocristalino (m-Si) e policristalino (p-Si). Células e módulos de silício amorfo (a-Si). Células e módulos de arseneto de gálio (GaAs). Células e módulos de disseleneto de cobre e índio (CIS) e de disseleneto de cobre, gálio e índio (CIGS) . Células e módulos de telureto de cádmio (CdTe). Células e módulos de multijunção. Células e módulos de concentração (CPV). Células orgânicas. Células sensibilizadas por corantes."
ESTM005-17,Materiais Metálicos,4,"Estruturas cristalinas. Defeitos puntiformes, lineares, planares e volumétricos. Nucleação e crescimento. Fusão e solidificação. Diagramas de Equilíbrio. Formação de microestruturas a partir do resfriamento. Mecanismos de endurecimento em metais. Soluções solidas. Fases intermediarias. Encruamento, recuperação, recristalização e crescimento de grãos. Ligas ferrosas. Ligas não-ferrosas."
ESZM030-17,Materiais Nanoestruturados,4,"Histórico da evolução dos materiais micro estruturados para os nano estruturados. Revisão geral das técnicas de síntese de materiais. Síntese de materiais policristalinos e monocristalinos; Técnicas de crescimento epitaxiais; Técnicas de deposição de filmes finos. Fulerenos e Nanotubos de carbono: propriedades e aplicações. Estruturas nanométricas: nanofios, nanofitas, nanoespiras. Técnicas de crescimento de materiais nanoestruturados: top- down e bottom-up. Técnicas de observação de nanoestruturas: Microscopia eletrônica; Microscopia de varredura por sonda (STM, AFM); Propriedades em escala nanométrica: Estrutura eletrônica de sistemas unidimensionais e adimensionais; Efeitos Quânticos: interações de troca; Propriedades vibratórias e térmicas; Considerações éticas, avanços e aplicações de materiais nano estruturados."
ESZM027-17,Materiais para Energia e Ambiente,4,"Materiais para Conversão de Energia e Proteção Ambiental: Avanços científicos e política econômica. A Concepção de Emissão Zero do Século XXI. Degradação de Materiais e Ambiente. O Ciclo do Carbono. Mudança de Paradigmas em Materiais: Desafios colocados pelos temas de desenvolvimento sustentável - ISO14000 e Reciclagem de Materiais. Energias renováveis. Princípios de geração e transformação da energia. Catálise. Células solares: fundamentos, princípios de operação e tecnologias para fabricação. Materiais utilizados em células solares. Células a combustível: fundamentos, princípios de operação e tecnologias para fabricação. Materiais utilizados em célula a combustível. Turbinas eólicas: fundamentos, princípios de operação e tecnologias para fabricação. Materiais utilizados em turbinas eólicas. Motores elétricos: fundamentos, princípios de operação e tecnologias para fabricação. Materiais utilizados em motores elétricos. Materiais Condutores: características, propriedades, aplicações. Ligas Metálicas. Resistências de Aquecimento. Fusíveis. Materiais Isolantes: características, propriedades, aplicações. Componentes Elétricos: resistores, capacitores. Materiais Magnéticos: características, propriedades, aplicações, ligas. Relés Eletromagnéticos."
ESZM028-17,Materiais para Tecnologia da Informação,4,"Princípios de armazenamento de informação. Primeiras mídias: gravação mecânica, magnética. Novas formas de armazenamento de informações. Materiais para mídias ópticas, capacitivas, permanentes, voláteis e não voláteis de rápida resposta. Princípios de transmissão óptica da informação. Tipos de fibras ópticas, amplificadores, moduladores, transmissores e receptores. Propriedades ópticas não lineares em fibras ópticas."
ESTM006-17,Materiais Poliméricos,4,"Introdução Geral (definições, história, importância dos materiais poliméricos). Tipos de ligações químicas do carbono. Estrutura dos materiais poliméricos. Classificação. Polimerização. Massa molar e distribuição de massa molar. Conformação e configurações da cadeia polimérica. Termodinâmica de soluções de polímeros. Transições térmicas. O estado amorfo. Cristalinidade de polímeros. O estado elastomérico. Polímeros no estado fundido. Técnicas de processamento de materiais poliméricos."
ESZM021-17,Matérias Primas Cerâmicas,4,"Histórico da utilização de matérias primas cerâmicas e seu impacto no desenvolvimento tecnológico. Indústria cerâmica no Brasil e no mundo. Principais matérias primas: argilo-minerais (silicatos e aluminatos), óxidos (alumínio, magnésio, silício, titânio, zircônio, ferro), não-óxidos (carbetos, nitretos), fundentes para indústria de vidros (feldspatos). Método de extração e beneficiamento, composição química, estrutura. Aplicações."
NHT3068-15,Mecânica Clássica I,4,"Cinemática, Dinâmica, leis de Newton e equação de movimento de uma partícula; Potenciais gravitacionais, linhas de força e superfícies equipotenciais; Movimento sob uma força central, teoremas de conservação, dinâmica orbital; Dinâmica de um sistema de muitas partículas; Movimento em um sistemas de referencia não inerciais."
NHT3069-15,Mecânica Clássica II,4,"Princípio variacional e equação de Lagrange. Exemplos e aplicações da equação de Lagrange em problemas de força central; colchetes de Poisson, ação em função das coordenadas, variáveis de ângulo e ação, transformações canônicas, teorema de Liouville, Equações de Hamilton, equação de Hamilton- Jacobi, , invariantes adiabáticos."
NHZ3075-15,Mecânica Clássica III,4,"Dinâmica de corpos rígidos; Pequenas oscilações, osciladores acoplados e modos normais; Teoria de Perturbação e aplicações; Introdução a sistemas não lineares e caos."
ESTO015-17,Mecânica dos Fluidos I,4,"Introdução e conceitos fundamentais; Estática dos fluidos; Equações Básicas na Forma Integral para Volume de Controle, Introdução à Análise Diferencial."
ESTE024-17,Mecânica dos Fluidos II,4,Escoamento Viscoso Incompressível Interno e Externo; Perdas de Carga; Medidas de Pressão e Vazão; Noções de Máquinas de Fluxo.
ESTO008-17,Mecânica dos Sólidos I,4,"Estática, Geometria do deslocamento de um corpo deformável. Campo de deformações. Força e Tensão. Campo de tensões. Equações de equilíbrio. Equações constitutivas. Corpos elásticos. Lei de Hooke. Análise de tensões em estruturas simples. Barras e vigas: esforço normal, flexão e torção. Estados planos de tensões e deformações. Flambagem."
ESZS018-17,Mecânica dos Sólidos II,4,"Revisão das formulações fundamentais de tensão, deformação e deflexão em mecânica dos materiais. Lei de Hooke generalizada. Transformação de tensão e de deformação. Tópicos avançados de mecânica dos materiais: torção de tubos fechados de paredes finas, flexão de vigas não-simétricas, centro de cisalhamento para seções transversais de vigas de paredes finas, cilindros de paredes espessas, tensões de contato, concentrações de tensão. Estabilidade elástica e inelástica de colunas."
NHT3036-15,Mecânica Estatística,6,Revisão de Termodina?mica. Formalismo microcano?nico. Formalismo cano?nico. Gás ideal clássico monoato?mico. Meca?nica estatística clássica. Gás ideal clássico de moléculas diato?micas. Modelo de Debye para o calor específico dos sólidos. Radiação do corpo negro. Formalismo grande cano?nico. Gases ideais qua?nticos. Gás ideal de férmions - gás de elétrons. Gás ideal de bósons - gás de fótons.
NHT3037-13,Mecânica Geral,4,"Princípios da mecânica, gravitação, forças centrais, movimento em referenciais não inerciais, coordenadas generalizadas e vínculos, princípios variacionais, equações de Euler-Lagrange e de Hamilton, relatividade restrita."
NHT3072-15,Mecânica Quântica I,6,"Estrutura matemática: notação de Dirac, espaços de Hilbert discretos e contínuos. Postulados da mecânica quântica. Princípio de incerteza. Problemas unidimensionais e sistemas de dois níveis. Oscilador harmônico quântico e suas aplicações. Simetrias em mecânica quântica: translação espacial, translação temporal, paridade, rotações. Momento angular. Potencial central. Átomo de Hidrogênio."
NHT3073-15,Mecânica Quântica II,4,Adição de momento angular. Método variacional e método WKB. Teoria de perturbação independente do tempo. Teoria de perturbação dependente do tempo. I Introdução a equação de Dirac e estrutura fina e hiperfina do átomo de Hidrogênio. Introdução a teoria de espalhamento.
NHZ3077-15,Mecânica Quântica III,4,Operador de densidade. Evolução temporal e representação de interação. Fases de Berry. Partículas idênticas. Segunda Quantização (aplicações: gás de férmions e bósons). Quantização do campo eletromagnético. Formulação da mecânica quântica por integrais de caminho.
NHT4024-15,Mecanismos de Reações Orgânicas,4,"Introdução ao estudo mecanístico de reações químicas. Uso de cinética química para o esclarecimento de mecanismos. Adição nucleofílica a compostos carbonílicos (reatividade, mecanismos de adição/eliminação, reações envolvendo derivados de ácidos carboxílicos). Formação e reatividade de enolatos. Reações de substituição nucleofílica em compostos alifáticos (mecanismos SN1 e SN2, estereoquímica, nucleofilicidade, efeitos do solvente). Reações de eliminação (mecanismos E1 e E2, estereoquímica e regioquímica de eliminações). Adições polares a duplas ligações (adições eletrofílicas e nucleofílicas a alcenos, alcinos e dienos). Substituição eletrofílica e nucleofílica em compostos aromáticos. Introdução às reações pericícilicas (tipos de mecanismos pericíclicos; cicloadição Diels-Alder e investigação mecanística)."
NHZ4062-15,Meio Ambiente e Indústria,2,Impactos ambientais; Indicadores ambientais; Responsabilidade ambiental; sustentabilidade; Ferramentas de gestão ambiental – normas ISO 14000; legislação ambiental.
ESZP044-14,Meio Ambiente e Políticas Públicas,4,"Agenda ambiental, histórico, características e repercussões. Relações entre os tipos de recursos naturais, modos de apropriação e regimes de propriedade. Instituições, organizações e meio ambiente. Políticas públicas na área ambiental. Instrumentos de políticas públicas voltadas à sustentabilidade. Legislação e políticas públicas na área ambiental no Brasil. Impactos e conflitos da agenda ambiental em outras agendas."
MCZC013-15,Memória e Aprendizagem,4,"Esta disciplina tem como objetivo aprofundar o conhecimento do aluno sobre as bases biológicas e teóricas da memória e a relação com o processo de aprendizagem. Bases históricas, fenômenos e teorias de memória e aprendizagem, plasticidade neuronal; circuitos neurais; condicionamento clássico e operante; distúrbios de memória; modelos biológicos e computacionais de memória e aprendizagem; aplicações tecnológicas e implicações na educação e sociedade."
ESZP026-13,"Memória, Identidades Sociais e Cidadania nas Sociedades Complexas Contemporâneas",4,"Introdução à temática de Memória, Identidades sociais e cidadania. Os lugares da memória nas sociedades complexas contemporâneas. O global e o local na cultura: Memória, identidades e cidadania no contexto dos movimentos sociais e culturais brasileiros. Transformações culturais na passagem da cultura oral para a escrita. Identidades em choque e conflitos sociais no Estado democrático de Direito. Do oral para o escrito: entrevistas nas Políticas públicas. Diálogos entre a oralidade e a cultura mediática na sociedade contemporânea."
ESZT006-17,Mercado Imobiliário,4,"Princípios básicos do funcionamento do mercado imobiliário. Interrelações com dinâmica econômica, planejamento e gestão dos territórios. Mercado imobiliário: características gerais; agentes e fases na execução de projetos e programas; engenharia econômica aplicada aos empreendimentos imobiliários; conceitos de custo, valor e rentabilidade; financiamento, instrumentos financeiros e mercados imobiliários; política urbana: a perspectiva do mercado; dinâmica macroeconômica e mercados imobiliários."
ESZM023-17,Metalurgia Física,4,"Estrutura cristalina; solidificação dos metais e ligas; formação de microestruturas em metais e ligas; soluções sólidas e fases intermediárias; Projeção estereográfica e rede recíproca; discordâncias e mecanismos de escorregamento e empilhamento; deformação elástica, plástica e propriedades mecânicas; cinética e termodinâmica de transformações de fase em metais e ligas; difusão."
MCZB022-17,Metateoremas da Lógica Clássica,4,"Caracterização da lógica de primeira-ordem e a investigação de algumas propriedades formais. Distinção entre teoria e metateoria. Utilização de técnicas semânticas e sintáticas destinadas a estudar e provar propriedades de sistemas formais, e.g.; consistência, completude de Gödel, decidibilidade, compacidade. Investigação da própria concepção de prova formal e outras noções associadas, por exemplo, rigor, intuição. Estudo de fundamentos e limites dos métodos lógicos-matemáticos. Prova e investigação dos Teoremas de Incompletude de Gödel, Lema de Lindenbaum, Teorema de Löwenheim-Skolem, Teorema de Tarski, noção de categoricidade."
ESZG042-17,Metodologia de Análise de Riscos,2,"Definições: riscos e incertezas; o processo de análise de riscos, métodos de análise qualitativos e quantitativos: árvore de decisão, matrizes de risco, modelos autoregressivos de risco, método das variâncias-covariâncias, método de Monte Carlo."
