id_materias,nome,creditos,descricao
ESTO902-17,Engenharia Unificada I,2,"Apresenta os princípios e métodos de engenharia e suas inter-relações e aplicações, através de uma experiência prática e realista de projeto. Essa experiência será construída durante o processo de solução de desafios técnicos multidisciplinares propostos pelos docentes. Esses desafios devem estimular os alunos a aplicar seus conhecimentos e experiências de forma racional e planejada através da gestão de uma equipe multidisciplinar, organizada para pesquisar e desenvolver a solução dos problemas propostos. A solução apresentada deve envolver atividades de gestão, pesquisa, concepção, desenvolvimento, implementação, avaliação e comunicação. Como resultados dessa disciplina os alunos deverão apresentar toda a documentação técnica necessária para a reprodução da solução concebida. Dessa forma, o aluno desenvolverá sua capacidade de conceber soluções em equipe e descrevê-las segundo uma linguagem técnica."
ESTO903-17,Engenharia Unificada II,2,"Apresenta os princípios e métodos de engenharia e suas inter-relações e aplicações, através de uma experiência prática e realista de implementação de um projeto multidiciplinar, sua análise crítica, avaliação de desempenho e adaptação ou inovação. Essa experiência será construída durante o processo de replicação e inovação de projetos desenvolvidos em turmas passadas das disciplinas e Engenharia Unificada I e/ou II. A nova solução apresentada deve envolver atividades de gestão, interpretação, adaptação, pesquisa, concepção, desenvolvimento, implementação, avaliação e comunicação. Como resultados dessa disciplina os alunos deverão apresentar toda a documentação técnica necessária para a reprodução da solução concebida. Dessa forma, o aluno desenvolverá sua capacidade de interpretar criticamente documentos técnicos, adaptar e/ou conceber novas soluções em equipe e descrevê-las segundo uma linguagem técnica."
ESZP018-13,Ensino Superior no Brasil: Trajetórias e Modelos Institucionais,4,"A constituição das universidades medievais. A universidade moderna: ensino, pesquisa, laboratório e institutos especializados. O ensino superior no Brasil no século XIX: intercâmbios institucionais e circulação de saberes. A formação jurídica, o ensino de medicina, as escolas politécnicas. A aplicação da ciência: mineralogia, microbiologia, genética. As universidades no século XX: o ensino profissional, a pesquisa cientifica, e a configuração da comunidade científica. A formação de um sistema de ensino superior no Brasil. A constituição da pós-graduação. O dilema do ensino público versus ensino privado."
NHZ6004-18,Enzimologia e Biocatálise,6,"Estudar o processo de produção e a aplicação industrial de enzimas recombinantes de origens animal, vegetal e microbiana"
MCTB011-17,Equações Diferenciais Ordinárias,4,Teorema de Existência e Unicidade. Equações lineares. Exponencial de matrizes. Classificação dos campos lineares no plano. Classificação topológica dos sistemas lineares hiperbólicos. Equações lineares não homogêneas. Estabilidade de Lyapounov. Funções de Lyapounov. Pontos fixos hiperbólicos. Teorema de Linearização de Grobman-Hartman. Fluxo associado a uma equação autônoma. Conjuntos limites. Campos gradientes. Campos Hamiltonianos. Campos no plano: órbitas periódicas e Teorema de Poincaré-Bendixson.
MCTB012-13,Equações Diferenciais Parciais,4,"Classificação em tipos. Condições de contorno e valores iniciais. O método de separação de variáveis. Convergência pontual e uniforme das séries de Fourier, identidade de Parseval. Equação do Calor: condução do calor em uma barra, o problema da barra infinita. Equações da Onda: equação da corda vibrante, corda dedilhada, corda finita e semi-infinita, soluções generalizadas à Sobolev. Equações de Laplace: O problema de Dirichlet em um retângulo e no disco."
NHZ3078-15,Equações Diferenciais Parciais Aplicadas,4,Equações diferenciais parciais e suas classificações. Separação de Variáveis e Método de Frobenius. Polinômios de Legendre e harmônicos esféricos. Funções de Bessel. Polinômios de Hermite. Ortogonalidade e Problema de Sturm-Liouville. Funções de Green e distribuições.
ESTB028-17,Equipamentos Médico-Hospitalares,4,"Unidades de terapia intensiva: função e contexto; Centro cirúrgico: função e contexto; Equipamentos de UTI/Centro cirúrgico: Foco cirúrgico, Mesa cirúrgica, Equipamento de anestesia, Unidade eletrocirúrgica (Bisturí elétrico), Sistemas para Videocirurgia, Monitor de parâmetros fisiológicos (ECG, Temperatura, SpO2, ETCO2, PANI, PAI, BIS), Desfibrilador/Cardioversor, Ventilador pulmonar, Bomba de infusão de seringa, Bomba de infusão de equipo, Cama elétrica para UTI; Unidade de Diagnóstico por imagem: Função e contexto, Equipamento de raio X, Equipamento de Ultrassonografia e ecocardiografia, Equipamento de Tomografia Computadorizada por RX, Tomografia por Ressonância Magnética, Medicina nuclear – SPECT e PET."
ESZB013-17,Ergonomia,4,"Esta disciplina tem o objetivo de ensinar ao aluno noções de ergonomia, as influências do ambiente e do método de trabalho na saúde do indivíduo, formas corretas de se realizar uma tarefa e prevenção de lesões durante as atividades do dia a dia e do trabalho devido a erros de posturas e de operação."
MCZC007-15,Ergonomia Cognitiva,4,"Ergonomia e fatores humanos; Tópicos de estudo; Métodos de estudo; Neuroergonomia; Limites ao processamento da informação (percepção, atenção, memória, execução); Esforço cognitivo; Psicologia cognitiva e erros humanos; Análise de erros cognitivos; Interfaces homem-máquina; Desenho de software; Ambientes exigentes; Adaptação para pessoas com necessidades cognitivas especiais; Estudos de caso."
ESZE101-17,Escoamento Multifásico,4,"Introdução e definições; Revisão de escoamento monofásico; Introdução a Ebulição e Condensação; Modelos básicas do escoamento bifásico; Análise dimensional/similaridade aplicado a sistemas bifásicos; Padrões e mapas de fluxos gás-líquido; Balanços unidimensionais de massa, quantidade de movimento e energia em fluxo bifásico; Modelos cinemáticos: homogêneo, fases separadas, deslizamento; Padrões de escoamento bifásico gás-líquido; Correlações para cálculo de perda de carga e fração volumétrica em fluxo multifásico; Aplicações de escoamento multifásico."
NHZ1094-19,Escrita e Leitura na Educação em Ciências,2,"A linguagem científica e a linguagem cotidiana: diferenças e continuidades. Letramento, leitura e escrita como práticas construídas socialmente. Uso de diferentes gêneros textuais em aulas de ciências. Gêneros textuais científicos e a construção de conhecimento na ciência acadêmica e na escola. O livro paradidático/informativo/texto de não ficção em aulas de ciências. "
NHT4007-15,Espectroscopia,6,"Natureza da radiação eletromagnética. Teoria da interação da radiação eletromagnética com a matéria. Absorção e emissão de radiação. Intensidades de linhas espectrais. Instrumentação em espectroscopia. Fundamentos e técnicas das espectroscopias: rotacional, vibracional, Raman. Aproximação de Born-Oppenheimer. Fundamentos e técnicas de espectroscopia eletrônica; princípio de Franck-Condon; processos de excitação e decaimento eletrônico; fluorescência e fosforescência. Regras de seleção em espectroscopia, e relações com teoria de grupos. Princípios de espectroscopia RMN. Fundamentos básicos de radiação sincrotron e aplicações em espectroscopia."
ESTS007-17,Estabilidade e Controle de Aeronaves,4,"Princípios de estabilidade estática e dinâmica. Estabilidade estática longitudinal: estabilidade manche livre, estabilidade manche fixo. Controle estático longitudinal: trim longitudinal, força no manche, manobras. Estabilidade estática lateral e controle: estabilidade direcional, estabilidade lateral. Derivadas de estabilidade. Resposta de atuação dos controles. Piloto humano e qualidade de voo."
ESHR005-13,Estado e Desenvolvimento Econômico no Brasil Contemporâneo,4,"Estado e desenvolvimento econômico no Brasil Contemporâneo é um curso interdisciplinar que reúne temas afins das áreas de Economia e Políticas Públicas. No curso, são apresentadas as linhas gerais das políticas governamentais adotadas em diferentes períodos de destaque da economia brasileira, buscando a compreensão do estudante sobre o papel do Estado no fomento do desenvolvimento econômico e social. A disciplina apoia-se em uma abordagem histórica enfocando as principais fases da economia brasileira entre os séculos XX-XXI e esboça um panorama global do crescimento econômico e da melhoria das condições sociais."
BHO0101-15,Estado e Relações de Poder,4,"Política, Poder, Dominação e Estado. Cidadania, Democracia, Ideologia e Comportamento Político. Instituições e Processos Políticos: sistemas eleitorais, sistemas partidários e formas de governo."
ESTM001-17,Estado Sólido,4,"Estrutura cristalina e Rede Cristalina: Estrutura dos átomos. Teoria da difração (equações de Laue) e Rede Recíproca. Ligações químicas: sólidos iônicos, sólidos covalentes, sólidos metálicos, sólidos moleculares, sistemas amorfos. Vibrações da rede e fônons: redes monoatômicas e diatômicas. Propriedades térmicas dos fônons; calor específico, condutividade térmica. Gás de elétrons: estatística de Fermi-Dirac."
ESTS905-17,Estágio Curricular em Engenharia Aeroespacial,1,"Estudos de situações reais em engenharia junto a instituições ou empresas públicas ou privadas credenciadas pela Universidade. Atividade individual orientada por um docente do curso e elaboração do relatório. Supervisão da empresa ou instituição, de acordo com o plano de trabalho previamente estabelecido. Apresentação de relatório das atividades desenvolvidas no prazo estabelecido, conforme cronograma da disciplina."
ESTU905-17,Estágio Curricular em Engenharia Ambiental e Urbana,1,"Estudos de situações reais em engenharia junto a instituições ou empresas públicas ou privadas credenciadas pela Universidade. Atividade individual orientada por um docente do curso e elaboração do relatório. Supervisão da empresa ou instituição, de acordo com o plano de trabalho previamente estabelecido. Apresentação de relatório das atividades desenvolvidas no prazo estabelecido, conforme cronograma da disciplina."
ESTB905-17,Estágio Curricular em Engenharia Biomédica,1,"Estudos de situações reais em engenharia junto a instituições ou empresas públicas ou privadas credenciadas pela Universidade. Atividade individual orientada por um docente do curso e elaboração do relatório. Supervisão da empresa ou instituição, de acordo com o plano de trabalho previamente estabelecido. Apresentação de relatório das atividades desenvolvidas no prazo estabelecido, conforme cronograma da disciplina."
ESTE905-17,Estágio Curricular em Engenharia de Energia,1,"Estudos de situações reais em engenharia junto a instituições ou empresas públicas ou privadas credenciadas pela Universidade. Atividade individual orientada por um docente do curso e elaboração do relatório. Supervisão da empresa ou instituição, de acordo com o plano de trabalho previamente estabelecido. Apresentação de relatório das atividades desenvolvidas no prazo estabelecido, conforme cronograma da disciplina."
ESTG905-17,Estágio Curricular em Engenharia de Gestão,1,"Estudos de situações reais em engenharia junto a instituições ou empresas públicas ou privadas credenciadas pela Universidade. Atividade individual orientada por um docente do curso e elaboração do relatório. Supervisão da empresa ou instituição, de acordo com o plano de trabalho previamente estabelecido. Apresentação de relatório das atividades desenvolvidas no prazo estabelecido, conforme cronograma da disciplina."
ESTI905-17,Estágio Curricular em Engenharia de Informação,1,"Estudos de situações reais em engenharia junto a instituições ou empresas públicas ou privadas credenciadas pela Universidade. Atividade individual orientada por um docente do curso e elaboração do relatório. Supervisão da empresa ou instituição, de acordo com o plano de trabalho previamente estabelecido. Apresentação de relatório das atividades desenvolvidas no prazo estabelecido, conforme cronograma da disciplina."
ESTA905-17,"Estágio Curricular em Engenharia de Instrumentação, Automação e Robótica",1,"Estudos de situações reais em engenharia junto a instituições ou empresas públicas ou privadas credenciadas pela Universidade. Atividade individual orientada por um docente do curso e elaboração do relatório. Supervisão da empresa ou instituição, de acordo com o plano de trabalho previamente estabelecido. Apresentação de relatório das atividades desenvolvidas no prazo estabelecido, conforme cronograma da disciplina."
ESTM905-17,Estágio Curricular em Engenharia de Materiais,1,"Estudos de situações reais em engenharia junto a instituições ou empresas públicas ou privadas credenciadas pela Universidade. Atividade individual orientada por um docente do curso e elaboração do relatório. Supervisão da empresa ou instituição, de acordo com o plano de trabalho previamente estabelecido. Apresentação de relatório das atividades desenvolvidas no prazo estabelecido, conforme cronograma da disciplina."
MCZA051-17,Estágio Supervisionado em Computação,4,"Desenvolvimento de atividades de estágio individual para propiciar a complementação do processo de ensino-aprendizagem; possibilitar o desenvolvimento de atividades práticas que contribuam para a formação profissional em Computação; habilitar o exercício da competência técnica compromissada com a realidade dos campos de estágio; desenvolver espírito de investigação, atitudes científicas e habilidades necessárias à prática profissional em Computação; e desenvolvimento de habilidades de expressão escrita e oral."
MCTC015-13,Estágio Supervisionado em Neurociência I,1,Conforme plano de atividades.
MCTC016-13,Estágio Supervisionado em Neurociência II,1,Conforme plano de atividades.
MCTC017-13,Estágio Supervisionado em Neurociência III,1,Conforme plano de atividades.
ESTG011-17,Estatística Aplicada a Sistemas de Gestão,4,"Noções de amostragem e técnicas de amostragem probabilísticas e não probabilísticas aplicadas à tomada de decisões; principais distribuições por amostragem e o teorema do limite central voltado à estimação; construção de intervalos de confiança direcionados à tomada de decisão e à área de qualidade; determinação de tamanhos de amostras para dar suporte à tomada de decisão; teoria das decisões com apoio de testes de hipóteses paramétricos e não paramétricos; correlação entre variáveis: estudo das relações entre variáveis com ênfase na tomada de decisões; análise de regressão: introdução à modelagem voltada a aplicações na Engenharia de Gestão, envolvendo modelos lineares simples e lineares por transformação das variáveis."
NHH2007-13,Estética,4,Estudo das principais concepções do belo na história da filosofia. Idéia e imagem em Platão. O conceito de mímesis. A crítica da pintura e da poesia na República de Platão. A poética de Aristóteles. A tragédia e as artes dramáticas. Genialidade e imaginação. O belo e o sublime. Símbolo e alegoria. O romantismo e a noção de ¿fim da arte¿.
NHH2008-13,Estética: Perspectivas Contemporâneas,4,"Trata-se de disciplina que procura discutir as principais teses da estética na atualidade. Serão privilegiados temas e autores contemporâneos, especialmente aqueles que refletem sobre as principais criações artísticas da atualidade como o cinema, as artes plásticas, o romance e o teatro contemporâneos, a arte de vanguarda e a questão do pós-modernismo."
ESZG018-17,Estratégias de Comunicação Organizacional,4,"Intervenções de comunicação em domínios organizacionais específicos como saúde, educação, situações emergenciais; técnicas da comunicação em nível interpessoal, organizacional e midiático; dinâmica relacional baseada em indivíduos, grupos, organizações, comunidades e mídias; avaliação de práticas comunicacionais em diferentes contextos; práticas inovadoras; efeitos da comunicação midiática; análise crítica da relevância e eficácia das práticas comunicacionais; desenvolvimento de ações dirigidas de comunicação."
NHZ3007-15,Estrutura Atômica e Molecular,4,"Tópicos essenciais em teoria de grupos e ligações químicas. Métodos aproximados da mecânica quântica. Determinante de Slater. O Método Hartree-Fock e a Teoria do Funcional da Densidade (DFT). Configurações eletrônicas em átomos multieletrônicos. Método de Semi empíricos aplicados a moléculas orgânicas. Separação eletrônica e nuclear. O método SCF-LCAO-MO aplicado a moléculas poliatômicas. Funções de base Gaussianas. Modelos quânticos aplicados ao espectro rotacional e vibracional. Transições eletrônicas. Espectroscopia Raman. Espectroscopias de Ressonância Magnética Nuclear (NMR) e Ressonância Paramagnética Eletrônica (EPR), Estados excitados e fotoquímica."
BIK0102-15,Estrutura da Matéria,3,"A disciplina trata da contextualização atômica da Estrutura da Matéria. Por ser uma das disciplinas introdutórias ao Bacharelado Interdisciplinar, o formalismo matemático dos tópicos abordados não é aprofundado, dando-se ênfase à interpretação qualitativa das leis que regem o comportamento da matéria. Apresenta-se ao aluno uma percepção do macro a partir do micro por meio do estudo dos fenômenos físicos e químicos da matéria. Os principais tópicos abordados são: Do micro ao macro. Bases da teoria atômica. Propriedades dos gases. Natureza elétrica da matéria. Contexto do nascimento do átomo de Bohr (início da Teoria Quântica). Introdução à Mecânica Quântica. Átomos com muitos elétrons e Tabela Periódica. Ligação química. Interações Intermoleculares e Materiais."
NHT4049-15,Estrutura da Matéria Avançada,6,"FUNDAMENTOS DA TEORIA QUÂNTICA. Equação de Schrödinger (propriedades, interpretação, soluções simples, estados estacionários). Átomo de hidrogênio. Funções de onda para átomos multieletrônicos. Teorema variacional e teoria de perturbações (exemplo do átomo de He).TEORIA DO ORBITAL MOLECULAR. Aproximação de Born-Oppenheimer. Hamiltoniano eletrônico. Método de Hartree-Fock. Correlação eletrônica. Aproximações semi-empíricas. Teorema de Hellman-Feynman.DINÂMINA MOLECULAR. Elementos de Mecânica Estatística. Equações de Lagrange e Hamilton. Construção de Hamiltonianos empíricos. Dinâmica molecular. Termostatos (dinâmica no ensemble NPT).MÉTODOS AVANÇADOS DE ESTRUTURA ELETRÔNICA. Método de interação de configurações. Teoria de perturbação. Introdução à Teoria do Funcional da Densidade. Dinâmica molecular quântica (método de Car-Parinello)."
BIQ0602-15,Estrutura e Dinâmica Social,3,"Estrutura social e relações sociais; Dinâmica cultural, diversidade e religião; Estado, Democracia e Cidadania; Dimensão econômica da sociedade; Desigualdade e realidade social brasileira."
ESHT007-17,Estudos do Meio Físico,4,"Componentes do meio físico natural como base para o desenvolvimento dos sistemas naturais e sociais. Componentes do meio físico fundamentais para a adaptação e distribuição das espécies e desenvolvimento das sociedades humanas: Disponibilidade e qualidade da água; Águas superficiais e subterrâneas; Tipos de solo, Processos de formação e transporte dos solos. Topografia e Relevo."
BHQ0002-15,Estudos Étnico-Raciais,3,emergência do paradigma eurocêntrico; o racismo e a formação do mundo atlântico; o escravismo brasileiro; as culturas afro-brasileiras e indígenas; o pós-abolição e o mito da democracia racial no Brasil; os estudos sobre as desigualdades raciais no Brasil; trajetórias do movimento negro; trajetórias do movimento indígena; Pan-Africanismo e relações Brasil-África; a diversidade dos racismos no século XXI.
NHH2009-13,Ética,4,"Trata-se de disciplina com a qual se pretende discutir as condições de possibilidade da elaboração de conceitos, juízos e argumentos morais. Em torno desta problemática serão abordados alguns dos temas mais destacados abordados por autores diversos da tradição filosófica, incluindo eventuais interfaces entre a ética e outros campos filosóficos e não filosóficos."
BHP0001-15,Ética e Justiça,4,"Ética, moral e justiça. Éticas Deontológicas, Éticas Teleológicas e Éticas da Autenticidade. Sistemas de Normas Éticas e Sistemas de Normas Legais. Ética e Ciência. A Responsabilidade Moral dos Intelectuais. Debate contemporâneo sobre o Conceito de Justiça. Implicações éticas da Justiça. Sistemas Normativos e Ordem Social Justa. Justiça e Direito. Jusnaturalismo e Contratualismo. Ética, Justiça e Cidadania. A ideia de Justiça Internacional, sua prática e seu desenvolvimento contemporâneo."
NHH2010-13,Ética: Perspectivas Contemporâneas,4,"A disciplina destina-se a discutir questões concernentes à construção de sistemas normativos bem como de Ética aplicada às situações de ação. Serão privilegiados temas e autores contemporâneos, selecionados, inclusive, a partir da identificação dos desafios éticos mais relevantes na atualidade."
NHZ1024-15,Etnofarmacologia,3,"Compreensão das relações entre conhecimento popular, medicina folclórica, e sua contribuição para a descoberta e desenvolvimento de fármacos derivados de produtos naturais. Tópicos abordados: Etnobotância e etnofarmacologia. Estratégias de pesquisa de campo e de coleta. Principais classes de compostos bioativos em plantas medicinais. Noções de farmacognosia e farmacologia. Legislação de acesso ao patrimônio genético e ao conhecimento tradicional. Registro de fitoterápicos."
NHT1062-15,Evolução,4,Padrões e processos macro e microevolutivos; forças evolutivas e processos de evolução de populações; especiação; modelos evolutivos e sua utilização na análise da evolução.
NHZ3008-15,Evolução da Física,4,"Apresentação geral do desenvolvimento histórico da física. As contribuições dos principais pensadores/filósofos naturais/cientistas para a física ao longo dos séculos, desde a Grécia Antiga até o período contemporâneo. Seleção e análise detalhada de episódios históricos relevantes da história da física, a serem escolhidos pelo professor, tais como: a ciência grega na Antiguidade, o pensamento medieval sobre o mundo, a relação entre Renascimento e ciência moderna, a revolução na astronomia com Copérnico, a revolução na física do século XVII, a popularização da ciência e o desenvolvimento do eletromagnetismo nos séculos XVIII e XIX, a física quântica e a relatividade no século XX, dentre outros."
MCZB035-17,Evolução dos Conceitos Matemáticos,4,"Investigação acerca dos conceitos matemáticos e da Matemática por intermédio da evolução de seus conceitos; matemática de natureza empírica, ou seja, os conceitos matemá- ticos e a matemática empírica e indutiva da Antiguidade à Grécia Helênica e em outros mo- mentos históricos; matemática e fundamentos da matemática na Grécia Helênica; justificação em matemática, a noção de prova: indução, dedução e a abstração conceitual; temas de ge- ometria, de números e a aplicação do método axiomático material e do rigor; o desenvolvi- mento do cálculo diferencial e integral, os sistemas de números; a era dos infinitésimos e as- semelhados, as diferentes caracterizações dos objetos e dos métodos; matemática abstrata: conceito de função, estruturas algébricas, caráter algébrico dos objetos e das relações; geo- metrias não-euclidianas; método axiomático formal; teoria de conjuntos, concepção estrutu- ral, e fundamentos da matemática; matemáticas não-clássicas."
NHT1067-15,Evolução e Diversidade de Plantas I,4,"Morfologia, diversidade e evolução de organismos fotossintetizantes com clorofila a: Cyanobacteria, Rhodophyta e Viridiplantae (exceto Lignófitas)."
NHT1068-15,Evolução e Diversidade de Plantas II,6,"Morfologia, diversidade, sistemática e evolução das principais linhagens de Lignófitas."
BIL0304-15,Evolução e Diversificação da Vida na Terra,3,Diferentes níveis de organização dos seres vivos e a sua relação com o processo evolutivo. Mecanismos de diversificação da vida relacionados à estrutura e atividade de biomoléculas e de outros níveis de organização. A evolução como produtora de padrões e processos biológicos. Organização taxonômica dos seres vivos.
NHZ1026-15,Evolução Molecular,3,"Evolução de genes e proteínas, organização e evolução de genomas; taxas de mutações e relógios moleculares; reconstruções filogenéticas a partir de dados moleculares."
NHZ2011-11,Existencialismo,4,"Toma destacadas expressões da filosofia existencialista contemporânea, inclusive suas formas alemã (Filosofia da Exzistenz) e francesa (Existencialismo). Busca identificar elementos que permitem certa unidade ao conjunto desta corrente filosófica, bem como suas divergências internas."
