id_materias,nome,creditos,descricao
MCZB028-13,Processos Estocásticos,4,"Introdução e fundamentos. Construção de cadeias de Markov. Medidas invariantes. Perda de memória e convergência ao equilíbrio. Processo de Poisson. Processos Markovianos de salto. Exemplos: nascimento e morte, ramificação. Processos estocásticos com interação, construção gráfica."
NHZ4064-15,Processos Industriais Cerâmicos,4,"Estudar a síntese, caracterização e processamento de materiais cerâmicos; Estudar as diversas etapas do processo cerâmico: obtenção da matéria prima, moagem, conformação, sinterização; estudar as especificidades de produção de material cerâmico de acordo com o setor produtivo."
NHZ4035-15,Processos Industriais Orgânicos e Inorgânicos,4,Estuda os fenômenos e reações envolvidos nos processos industriais orgânicos e inorgânicos
ESZE031-17,Processos Termoquímicos de Conversão Energética,2,"Introdução aos processos termoquímicos. Conceitos fundamentais e importância. Caracterização de combustíveis e técnicas de preparação para seu uso em processos de transformação termoquímica. Combustão: estequiométrica, balanço de massa e energia. Aspectos tecnológicos (tipos de caldeiras, fornos e fornalhas para combustíveis fósseis e renováveis). Gaseificação: aspectos teóricos. Tipos de gaseificadores. Modelagem do processo. Considerações tecnológicas e econômicas. Pirólise: aspectos teóricos do processo. Tipos de pirolisadores. Descrição dos processos de pirólise lenta e pirólise rápida. Desafios tecnológicos e considerações econômicas. Liquefação. Aspectos teóricos do processo. Considerações técnico-econômicas."
MCZA033-17,Programação Avançada para Dispositivos Móveis,4,Conceitos fundamentais da programação móvel. Aparência do aplicativo. Banco de dados e programação móvel. Integração com recursos do aparelho. Integração com outros sistemas: envio de dados ao servidor. Programação para smartphones X Programação para tablets.
ESZI043-17,Programação Baseada em Componentes para Jogos,4,"Revisão de Princípios de Programação e introdução ao C# no Unity 3D. Objetos, Classes, Métodos e Componentes no Unity 3D. Interfaces e uso de componentes básicos de jogos. Documentação e algumas boas práticas de programação em componentes e em Jogos."
ESZI033-17,Programação de Dispositivos Móveis,2,"Introdução à Programação de Dispositivos Portáteis baseados no S.O. Android usando uma Linguagem Orientada a Objeto (Java) ou Imperativa (C#), Desenvolvimento de Aplicações, Interfaces Gráficas, Principais Componentes e Comandos, Uso de APIs no Desenvolvimento de Aplicativos."
ESZI041-18,Programação de Software Embarcado,4,"Programação orientada a eventos e sistemas concorrentes, máquinas de estado e UML, exemplo de documentação de sistema."
MCTA028-15,Programação Estruturada,4,"Apresentar noções básicas e intermediárias sobre algoritmos, programação em linguagens compiladas, compilação, programas em execução (processos), ponteiros, alocação estática e dinâmica de memória, vetores e matrizes, funções e passagem de parâmetros, registros, arquivos e recursividade. Aplicar todos os conceitos apresentados no contexto da resolução de problemas clássicos e novos da computação."
MCTA017-17,Programação Matemática,4,Introdução: revisões de álgebra linear e conjuntos convexos. Programação linear: modelagem; resolução gráfica; teoremas básicos; o método simplex; simplex revisado; dualidade; algoritmos primal-dual e dual-simplex; análise de sensibilidade. Programação Dinâmica.
MCTA018-13,Programação Orientada a Objetos,4,"Conceitos básicos: classes, objetos, mensagens, encapsulamento, herança, polimorfismo. Programação orientada a objetos utilizando uma linguagem de programação orientada a objetos (Java). Análise e projeto orientados a objetos. UML. Padrões de projeto de software."
MCZA019-17,Programação para Web,4,Conceitos de aplicações Web. Modelo MVC para modelagem de aplicações Web interativas. Plataforma Java para desenvolvimento de aplicações na Web. XML e Java.
MCZA020-13,Programação Paralela,4,Introdução. Modelos de arquiteturas paralelas. Paralelismo. Tipos de acessos. Organização e distribuição de tarefas. Organização e distribuição de dados. Programação Paralela.
MCZA034-17,Programação Segura,4,"Segurança no processo de desenvolvimento de software; vulnerabilidades: descrição, tecnologias (linguagens, sistemas operacionais) envolvidas, prevenção e correção; ferramentas para prevenção de vulnerabilidade; Características relevantes de linguagens de programação: sistemas de exceções, sistema de tipos, código, nativo versus bytecode, outras características. prática: busca por vulnerabilidades em produtos reais."
MCTC009-15,Progressos e Métodos em Neurociência,4,"O objetivo desta disciplina é discutir os avanços nas áreas de neurociências, bem como a utilização de metodologias contemporâneas utilizadas para estabelecer tais avanços. Embora a ênfase seja em aspectos biológicos, as interfaces com as áreas tecnológicas e de ciências humanas também serão contempladas. O conteúdo desta disciplina é de extrema importância para se projetar os rumos desta área da Ciência. Serão discutidas e exemplificadas as bases da experimentação psicofísica, eletrofisiológica, anatômica, comportamental, celular, molecular, bioinformática e neuroproteção/regeneração."
ESTU040-17,Projeto Ambiental Urbano,4,"Análise e leitura integrada dos condicionantes do projeto ambiental urbano. Estudo de metodologias de análise e projeto ambiental-urbano relacionadas a diversos aspectos: funcionais, sintáticos, conforto ambiental, biogeofísicos, aptidão à urbanização, suscetibilidade a processos e risco geológico-geotécnico. Desenvolvimento de projeto de intervenção ambiental-urbano em escala intraurbana."
ESTA019-17,Projeto Assistido por Computador,2,"Introdução ao desenho assistido por computador (CAD), Modelagem de peças em 3D (geração de sólidos por extrusão, revolução, varredura, cascas, loft), Folha de desenhos, projeto e análise de montagens, cálculo de cargas e tensões estáticas."
ESZS028-17,Projeto de Aeronaves I,4,Introdução ao projeto de aeronaves. As diferentes fases do projeto de uma aeronave. Dimensionamento a partir do esboço conceitual. Seleção do aerofólio e geometria da asa. Relação peso-potência e carga alar. Dimensionamento inicial. Configuração do layout e loft. Noções de engenharia de interiores.
ESZI036-17,Projeto de Alta Frequência,4,Análise dos Parâmetros de Circuitos de RF; Modelagem de Componentes Passivos e Ativos de RF; Redes de Casamento e de Polarização; Não linearidade e Distorção; Ruído; Amplificadores de Baixo Ruído; Amplificadores de Potência; Osciladores Senoidais; Misturadores e Conversores de Frequência; Sintetizadores de Frequência.
ESZA024-17,Projeto de Controle Discreto,3,"Projetos de sistemas de controle em tempo discreto baseado no método no método de resposta em frequência; Análise no espaço de estados de sistemas de controle em tempo discreto lineares invariantes no tempo controlabilidade, observabilidade; Solução das equações de estado em tempo discreto; Matriz da função de transferência; Projeto baseado na alocação de polos, resposta deadbeat, controle com entrada de referência, controle integral."
ESTS013-17,Projeto de Elementos Estruturais de Aeronaves I,4,"Introdução; Filosofias de projeto de estruturas aeronáuticas; Requisitos de certificação; Carregamentos em estruturas aeronáuticas; Tipos de abordagem de análises (analítica, computacional e experimental); Projeto estrutural de asas e superfícies; Projeto estrutural de fuselagens; Projeto estrutural de junções."
ESZS015-17,Projeto de Elementos Estruturais de Aeronaves II,4,"Introdução; Filosofias de projeto de estruturas aeronáuticas; Requisitos de certificação; Espectros de carregamentos em estruturas aeronáuticas; Tipos de abordagem de análises (analítica, computacional e experimental); Projeto estrutural de asas e superfícies quanto à fadiga; Projeto estrutural de fuselagens quanto à fadiga; Projeto estrutural de junções quanto à fadiga."
ESZI016-17,Projeto de Filtros Digitais,4,Características dos Filtros Digitais; Filtros de Fase Linear; Projeto de Filtros FIR; Projeto de Filtros IIR.
ESZE113-17,Projeto de Geradores Elétricos para Energia Eólica,2,"Geradores: Topologias mais comuns em geradores elétricos; Princípio de Funcionamento dos geradores; A máquina elétrica de indução de fluxo radial: características principais, princípio de funcionamento no modo gerador. Funcionamento da máquina de indução como Gerador de Indução Duplamente Alimentado; A máquina elétrica brushless de fluxo radial: características principais, princípio de funcionamento no modo gerador. A máquina elétrica de relutância variável de fluxo axial: características principais, princípio de funcionamento no modo gerador. A máquina elétrica de síncrona: características principais, princípio de funcionamento no modo gerador. A máquina elétrica de fluxo axial: características principais, princípio de funcionamento no modo gerador. A máquina elétrica de fluxo transversal: características principais, princípio de funcionamento no modo gerador. Apresentação dos modelos mais comuns utilizados em simulações computacionais de máquinas elétricas."
MCTA029-17,Projeto de Graduação em Computação I,8,"Desenvolvimento de atividades de projeto individual para exercício dos conhecimentos e habilidades adquiridos no curso; desenvolvimento do potencial criativo individual, para propostas de soluções de problemas; estruturação e apresentação do projeto de acordo com metodologias científicas e desenvolvimento de habilidades de expressão escrita e oral."
MCTA030-17,Projeto de Graduação em Computação II,8,"Desenvolvimento de atividades de projeto individual para exercício dos conhecimentos e habilidades adquiridos no curso; desenvolvimento do potencial criativo individual, para propostas de soluções de problemas; estruturação e apresentação do projeto de acordo com metodologias científicas e desenvolvimento de habilidades de expressão escrita e oral."
MCTA031-17,Projeto de Graduação em Computação III,8,"Desenvolvimento de atividades de projeto individual para exercício dos conhecimentos e habilidades adquiridos no curso; desenvolvimento do potencial criativo individual, para propostas de soluções de problemas; estruturação e apresentação do projeto de acordo com metodologias científicas e desenvolvimento de habilidades de expressão escrita e oral."
ESZA014-17,Projeto de Microdispositivos para Instrumentação,4,Revisão dos principais microdispositivos sensores e atuadores; técnicas de fabricação de microdispositivos sensores e atuadores; técnicas para caracterização de microdispositivos; projeto de microsensores e microatuadores; encapsulamento de microdispositivos e integração com circuitaria.
ESZE112-17,Projeto de Microturbinas Eólicas,2,"Microturbinas: Funcionamento básico e componentes; Aerofólios, projeto e cálculo de pás; Partida da turbina e desempenho em ventos fracos; Aspectos de fabricação e teste; Aerodinâmica em condições transientes e proteção contra ventos extremos; Métodos de simulação de cargas; Torres; Aspecto do sistema: gerador, controlador de carga, inversor."
MCZA021-17,Projeto de Redes,4,"Abrangência e escopo de projetos de rede. Tipos de projetos de redes e o conhecimento necessário para realizá-los. Ciclo de vida de um projeto de rede; Análise de viabilidade de um projeto de rede. Uma metodologia top-down para projeto de rede. Fase 1: Identificação dos Requisitos do Cliente. Fase 2: Projeto Lógico da Rede. Fase 3:Projeto Físico da Rede. Fase 4: Testes, Otimização e Documentação do Projeto de Rede. Exemplos de Projeto de Rede; Execução de um projeto de rede."
ESZI023-17,Projeto de Sistemas de Comunicação,3,"Sistemas de Comunicação – estrutura sistêmica com exemplos; Modulação e Demodulação Analógica; Modulação e Demodulação Digital; Amostragem – aliasing e reconstrução; Codificação de Canal; Codificação de Fonte e Criptografia; Detecção de Sinais – diagrama de olho e princípios de equalização; Sincronismo e Sistemas de PLL; Multiplexação e Demultiplexação – TDM, FDM; Projeto de um Sistema de Comunicação."
ESZI038-17,Projeto de Sistemas Multimídia,3,"Introdução aos projetos de sistemas multimídia. Introdução às ferramentas e instrumentos de desenvolvimento de processamento multimídia. Realização de experimentos práticos de processamento de sinais. Realização de etapas de projeto: planejamento, concepção sistêmica, desenvolvimento, verificação, validação, e análise de resultados. Apresentação do projeto final."
BCS0002-15,Projeto Dirigido,2,"Elaboração de projeto teórico, experimental ou computacional a ser desenvolvido sob a orientação de um ou mais professores da UFABC."
ESZB037-17,Projeto e Análise de Próteses e Órteses,4,"Materiais e suas propriedades, biomateriais, método de elementos finitos aplicados a problemas multifísicos, biomecânica, engenharia de reabilitação, metodologia de projeto, métodos de otimização e métodos de análise."
ESZB033-17,Projeto e Desenvolvimento de Interfaces Cérebro-Máquina,4,"Introdução a sistemas BCI, suas motivações, desafios e ferramentas disponíveis; Bases biofísicas do EEG, seus ritmos essenciais, formas de aquisição e instrumentação necessária; Principais paradigmas BCI: P300, imagética de tarefas, potenciais evocados em regime estacionário; Principais módulos de processamento de sinais em BCI: pré-processamento, filtros espaciais e temporais, extração de características, seleção de características, classificação, análise de desempenho. O papel da realimentação no desempenho de sistemas BCI e toolboxes disponíveis; Casos de estudo e estado da arte em sistemas BCI."
ESZB017-17,Projeto e Desenvolvimento de Sistemas para Análise de Dados Médicos,5,"Técnicas de gerenciamento de projetos de desenvolvimento de software. Estimação de custos. Análise e especificação de requisitos. Arquitetura de sistemas de bancos de dados. Modelagem de dados: projeto conceitual, lógico e físico. Modelo entidade relacionamento básico e estendido e modelo relacional. Introdução a SQL. Dependências funcionais e normalização de relações. Bancos de dados web. Princípios de segurança de dados. Sistemas de informação em Saúde. Padronização da Informação em Saúde - Padrão HL7 e DICOM. Prontuário Eletrônico do Paciente. Análise de sistemas hospitalares e relacionados à engenharia biomédica. Perspectivas e desafios tecnológicos na criação de sistemas para a área de engenharia biomédica."
MCZA022-17,Projeto Interdisciplinar,4,"Desenvolvimento de tema de pesquisa de acordo com temas geradores, desenvolvimento e elaboração de um projeto baseado no tema da pesquisa. Estruturação, documentação e apresentação do projeto."
ESZG043-17,Projeto Virtual e Integrado de Manufatura,4,"Modelo estruturado para projeto e desenvolvimento da manufatura. Projeto virtual e integrado da manufatura (PVIM): campos de aplicação. Requisitos para o PVIM. Fábrica Digital (DF) e Fábrica Inteligente (SF). Fundamentos de projeto, modelagem e simulação. Robótica. Sistemas ciberfísicos (CPS) e comunicação entre máquinas. Projeto da manufatura, modelagem, testes, simulação e validação."
MCZD005-18,Projetos de Ensino de Matemática e Ciências com Arte,4,"Abordagem dos processos de formação e formalização de conceitos da Matemática e das Ciências da Natureza pertinentes à Educação Básica, de forma criativa, sensorial e sensível, por meio de jogos de improvisação teatral e da elaboração de cenas, a partir de textos literários, peças de teatro e textos científicos com temática relacionada a essas áreas de conhecimento. Desenvolvimento e aprofundamento da escuta e do diálogo, verbal e não verbal, por meio de atividades de expressão corporal, associados a reflexões sobre a natureza epistemológica da Matemática e das Ciências, seus conteúdos de ensino conceituais, procedimentais e atitudinais, bem como a relação pedagógica professor-estudantes conhecimentos. Elaboração de projetos de ensino."
ESZG012-17,Projetos Industriais,4,"Conceito de projeto, parâmetros, tipos e ciclo de vida; gestão de projetos, requisitos e perfil do gestor; planejamento do projeto: objetivo, atividades, recursos e orçamento; administração de contratos; projeto de uma fábrica."
ESZI039-17,Propagação e Antenas,4,"Elementos de um Sistema de Rádio Propagação; Fenômenos de Propagação; Modelo de Propagação em Espaço Livre; Propagação em Espaço Semi-Livre; Modelo de Propagação Urbana; Propagação em Micro-ondas; Conceitos Básicos de Antenas: Principais Características e Propriedades Elétricas, Principais Tipos, Estudo de Radiadores Simples, Impedância de Antenas Lineares Finas, Teoria das Redes Lineares, Antenas de Abertura, Antenas com Refletores, Antenas Receptoras, Medidas em Antenas."
ESTG025-17,Propriedade Intelectual,4,Evolução histórica do direito da propriedade intelectual e a ideia da difusão do conhecimento; direito industrial e interesse público; direito industrial e direito da concorrência; patentes: limites ao seu reconhecimento; licenciamento voluntário e compulsório; a proteção do conhecimento tradicional; indicação geográfica; modelo de utilidade; direitos autorais; marcas registráveis; cultivares; desenhos industriais: desenhos registráveis; sistema patentário internacional; a propriedade intelectual e o conhecimento.
ESTM019-17,"Propriedades Elétricas, Magnéticas e Ópticas",4,"Introdução a propriedades físicas de materiais; Introdução aos materiais ópticos; Modelos de Lorentz, Drude e Tauc-Lorentz; Absorção interbanda: semicondutores e aplicações em fotodetectores; Excitons: princípios, comportamentos em campos elétricos e magnéticos; Luminescência: fotoluminescência, eletroluminescência, aplicações; Fibra óptica e óptica não linear (FWM, BBS, dispersão cromática, dispersão por polarização); Características de materiais metálicos, semicondutores e isolantes; Dispositivos semicondutores: junções PN, Schotky, fotodetectores, LED, lasers de estado solido; Propriedades de Materiais Metálicos, semicondutores e supercondutores: Condução elétrica; semicondutividade; condução elétrica em cerâmicas iônicas e polímeros; Comportamento dielétrico; Piezeletricidade, Piroeletricidade e Ferroeletricidade; Propriedades de materiais magnéticos: Origem elétrica (elétron em movimento) no átomo; Diamagnéticos e Paramagnéticos; Ferri/ferromagnéticos e Anti-ferromagnéticos. Dispositivos: gravadores HD."
NHZ3085-15,Propriedades Magnéticas e Eletrônicas,4,"Campo magnético; Magnetização e momentos magnéticos; Magnetismo em materiais: diamagnéticos, paramagnético, ferromagnético, antiferromagnético, ferrimagnético e superparamagnéticos. Supercondutividade. Materiais dielétricos e ferroelétricos; Sistemas de baixa dimensionalidade. Experimentos envolvendo tais propriedades físicas."
ESTM010-17,Propriedades Mecânicas e Térmicas,4,"Principais propriedades térmicas dos materiais e sua relação com a microestrutura. Transições de fase, temperaturas de transição, capacidade calorífica e condução de calor. Caracterização térmica de materiais. Relação entre as propriedades mecânicas de materiais com suas características mecânicas. Caracterização mecânica dos materiais. Mecânica de fratura."
ESZS033-17,Propulsão Aeroespacial Não-Convencional,4,Pesquisa básica e tecnologias associadas aos sistemas de propulsão aeroespacial não- convencionais.
ESZE076-17,Proteção de Sistemas Elétricos de Potência,4,Definições básicas e elementos de proteção; Diagramas esquemáticos de sistemas de controle e proteção; Transformadores de corrente e potencial; Cálculos de correntes de curto- circuito; Proteção de linhas; Proteção de transformadores; Proteção de barras; Proteção de motores e geradores; Proteção contra surtos; Influência do sistema de proteção nos critérios de planejamento e investimentos em sistemas elétricos; Introdução aos relés numéricos e algoritmos utilizados.
NHZ6006-18,Proteínas Recombinantes,4,"Conhecer a estrutura das proteínas e suas funço?es, bem como processos para obtenção de proteínas recombinantes e métodos de extração, purificação e caracterização."
MCTC011-15,Psicologia Cognitiva,4,Introdução à psicologia cognitiva (como são estudados e entendidos processos cognitivos básicos e processos mentais de ordem superior no campo da psicologia cognitiva); Neurociência cognitiva (relação entre mente e cérebro); Percepção; Atenção e consciência; Memória; Representação mental da informação e organização do conhecimento; Linguagem; Resolução de problemas e criatividade; Raciocínio e tomada de decisão; Raciocínio matemático; Emoção e motivação (como estados afetivos influenciam processos cognitivos); Inteligência humana e artificial; Desenvolvimento Cognitivo.
MCTC020-15,Psicologia Experimental,6,"História de psicologia experimental; Aspectos gerais de estudos em psicologia experimental; Metodologia experimental; Aspectos éticos na psicologia experimental; Instrumentos e métodos comportamentais em humanos; Instrumentos e métodos comportamentais em animais; Psicofísica; Paradigmas de pesquisa em sensação, atenção, aprendizagem, memória, motivação e emoção; Condicionamento; Introdução à psicologia experimental social. Aulas práticas em planejamento e execução de experimentos comportamentais e uso de equipamentos, instrumentos e software."
ESZE073-17,Qualidade da Energia Elétrica,4,Introdução à qualidade de energia elétrica; Termos e definições; Tipos de distúrbios; Variações de tensão de curta duração; Variações de tensão de longa duração; Transitórios; Harmônicos.
ESZB011-17,Qualidade de Imagens Médicas,4,Limitações nos sistemas de formação de imagem médica; Teoria de transferência em análise de imagem; Ruído em imagens médicas; Figuras de mérito em avaliação de qualidade de imagem médica; Processamento de imagem como recurso para avaliação e melhoria da qualidade da imagem médica; Informações quantitativas em imagens médicas; Teoria de detecção de sinal; A influência da qualidade de imagens no diagnóstico médico.
ESZG035-17,Qualidade em Serviços,2,Tipologia dos Serviços. Papel dos serviços na economia. Serviços e Manufatura. Gestão estratégica dos serviços. Serviços emergentes na economia. Modelos de negócios em serviços. Organização do trabalho e da estrutura em serviços. Qualidade em serviços: conceito e ferramentas para mensuração da qualidade em serviços. Serviços compartilhados.
ESTG016-17,Qualidade em Sistemas,4,Teoria geral dos sistemas; o conceito moderno de qualidade; perda zero; normas técnicas e procedimentos relacionados; principais ícones da qualidade; normas; as sete ferramentas da qualidade; análise de modos de falha; confiabilidade do produto; gerenciamento da qualidade.
ESZU016-17,Questões Ambientais Globais,2,"Introdução à questão ambiental global: dimensões e controvérsias: biodiversidade, escassez da água, poluição atmosférica, risco nuclear, aquecimento global. Aspectos científicos do sistema climático e mudança do clima: parâmetros dos modelos de previsão e análise, fatores humanos, fatores naturais, ciclo de carbono. Vulnerabilidade dos sistemas sócio- econômicos e naturais diante da mudança do clima: cenários de mudança climática, inércias em ciclos naturais, inércias institucionais, impactos regionais. Opções de limitação da emissão de efeitos causadores da mudança do clima: fatores de mitigação, fatores de adaptação, tecnologias, cooperação e acordos internacionais."
NHZ5014-15,Questões Atuais no Ensino de Ciências,2,A História da Ciência e sua relação com o ensino. A linguagem e sua relação com o ensino de ciências. As inovações tecnológicas e o ensino de ciências. Alfabetização Científica. A reflexão crítica e o ensino de ciências.
ESHC039-17,Questões Metodológicas em Economia,4,"Fundamentos da metodologia científica. A construção do conhecimento científico e a afirmação de teorias: a “visão recebida” e as respostas de Karl Popper, Thomas Kuhn e Imre Lakatos. Trabalhos clássicos da metodologia da economia, de John Stuart Mill a Milton Friedman. O papel da retórica na Economia. Ortodoxia, heterodoxia e mainstream. O papel da formalização e da econometria em economia. Valores e ideologia em economia."
ESZU037-17,Química Ambiental,2,"Introdução à Química Ambiental. Ciclos Biogeoquímicos. A química das águas naturais. Purificação de águas poluídas: a contaminação de águas subterrâneas, a contaminação de águas superficiais por fosfatos, o tratamento de águas residuais e de esgoto. A química do ar: a camada de ozônio. O efeito estufa e o aquecimento global. O uso da energia e emissões de CO2, trocas gasosa água-atmosférica, chuva ácida. A química dos solos: contaminação e remediação de solos contaminados. Educação ambiental."
